{
  "artifacts": {
    "config": {
      "path": "demo-deduplicate-baseline/config.json",
      "sha256": "be6e08b6f724592e419763b0f421b6ed513ccbfcef51a176c720cc55d4cc875a"
    },
    "fixture": {
      "path": "demo-deduplicate-baseline/fixture.json",
      "sha256": "40edbd86fc3df0d4c197c7a4fc517606d6f9d865bf4cb887d3b2f144b2f620c1"
    },
    "result": {
      "path": "demo-deduplicate-baseline/result.json",
      "sha256": "0f83635f6efb7cb149e43a6cf88b827f59c589523eee1507a956c37341129fc7"
    },
    "task": {
      "path": "demo-deduplicate-baseline/task.json",
      "sha256": "609b4f3c6711bc5cda83a854ef759d9ac3214518d5457d1d75e744cb7bcfa938"
    },
    "trace": {
      "path": "demo-deduplicate-baseline/trace.json",
      "sha256": "6278273d3e8bdd5577d1f8dbc460f90f73e4ffa62b7d45306dc7712af106deae"
    }
  },
  "cleanup": {
    "temporary_repository_removed": true
  },
  "config": {
    "config_id": "baseline",
    "max_model_calls": 5,
    "variant": "baseline"
  },
  "environment": {
    "offline": true,
    "platform": "win32",
    "python": "3.12.13",
    "runtime_source_hashes": {
      "lab/src/about_harness/__init__.py": "9680114a05d37bd201e5affd861e0b4a843160d027dba133ba0edc3d57a66238",
      "lab/src/about_harness/acceptance.py": "029cd4888850c9cf9afe492a3332cb74986da39d496b7fe2f4ddfc0b67f7ef98",
      "lab/src/about_harness/adapters/__init__.py": "07b2b2ce4362631b571bff5c0d9bd660cb770c0eefdf805fd099193ed3144624",
      "lab/src/about_harness/adapters/base.py": "2c8f7c740349799232272ce9a8321b684a6efcd589d4039635410dd0e43fd403",
      "lab/src/about_harness/adapters/fake.py": "42e205ddf44f15f2f07a17f8f0cc8334ab8c313aebdfc0f1c1ac6ed7101c8cfc",
      "lab/src/about_harness/adapters/live.py": "fddc301f41afa54ecd197672856eccb74e8f199cbf28245a19efeddb48332a92",
      "lab/src/about_harness/adapters/replay.py": "bfeb7e54f88fe35196521f7040cfeab36e32a711bd514e87eae13c7d7eeea6ec",
      "lab/src/about_harness/adapters/responses.py": "f0db200be08cc0704f278a7d1e841ac59857d2b050d112c66d73484dea8aadc9",
      "lab/src/about_harness/context.py": "d32aa4c831e859a485e0e3b102784c29cfead35138abf1679e003eaacc8b3a50",
      "lab/src/about_harness/contracts.py": "d9a29658874f26c89a25f5caa2cdfc9421b1334adb541dd5eab32279f74ab15b",
      "lab/src/about_harness/integrations/__init__.py": "56905f16482e6e4af3cb23b8b2d5323e0791a3be026b808e921809f1b2ba4837",
      "lab/src/about_harness/integrations/base.py": "66d5702de59bd2199512118a8ac04662e878005ee3eb0039e1c69e129a092df4",
      "lab/src/about_harness/integrations/browser_use.py": "8807667cf418dfba5eaa62881b7b793689b8504aecaa348792bbde53243f14eb",
      "lab/src/about_harness/integrations/langgraph.py": "fb0cadef8ebbb0fe6250d079d227be56cb1d531b7418b7702f4c4c2d94d209ac",
      "lab/src/about_harness/integrations/llama_index.py": "162df727f7109d1529c8598722e174d202548c105652338d6a8bb964cd8b8235",
      "lab/src/about_harness/integrations/pydantic_ai.py": "5edca5b4accf5a5c0e1f35a7269fa2e6b507cfb01ccf178a5dbb29a5371f514e",
      "lab/src/about_harness/labs.py": "ba766b8127be6f6cb23c9ca2bf548df922248f142b9df55f91d97040b8e3b106",
      "lab/src/about_harness/loop.py": "a0cdb6d21a7a509d9b5299232d5212910ec414c612644860702a9efeefc307e3",
      "lab/src/about_harness/memory.py": "107e0428528fd5d710ce89155eae82acddd0c0f9a639a353286d678808a0b3d8",
      "lab/src/about_harness/policies.py": "4f8550ce991bc2a34c9bde9f1e8284501051b571269cc7a0a868e41ab5ec1250",
      "lab/src/about_harness/recovery.py": "7c77cf65ebde43317841b278a71d6bd90f4d39f22c0eeec745adc1dd505d220d",
      "lab/src/about_harness/retry.py": "a3c3679a9efe7cdb6e715c4ba31ce3d33339ad30df7b5e3c991793fb50998c15",
      "lab/src/about_harness/source_labs.py": "2e39b46087e1743f3d1f58a864539f17e0c86e9088adb48093a890dd520bec7a",
      "lab/src/about_harness/streaming.py": "3a0acf3e6bbc38202b4215eba907b27da6804a8b0c0540d1cb022dc70c5f04ac",
      "lab/src/about_harness/study_demo.py": "974ba20efc2c418913c4d732963eb751ab6b450fd6a02f9a9f33581e52a1f7dc",
      "lab/src/about_harness/tools.py": "78b0a2a68b62eed41db60270f1e3ddbf850a2c4724068a4985728c2fb10034fa",
      "lab/src/about_harness/trace.py": "747e7c3c22e9843991dcf7db61bb4d6fbe2ec0dfe50ff19d2afcfc9a5de434e5",
      "lab/src/about_harness/usage.py": "9797bf292bf1f6700abed591e955a9b1133ea1c0644aedee92bd00661ca7a25e"
    },
    "source_commit": "bd5ed23f8b1904c8f276cecff4fb6ae490dcbdd0"
  },
  "execution_artifacts": {
    "baseline-test.json": {
      "path": "demo-deduplicate-baseline/baseline-test.json",
      "sha256": "38922ba66ba125c32bdfcd26da5da89f2d29bd13a45e4bc5340e9607e873a3e0"
    },
    "candidate.patch": {
      "path": "demo-deduplicate-baseline/candidate.patch",
      "sha256": "3f860cf221cf69446baf023b708c4688f9dd87798e804d24f7025574cc24ba7a"
    },
    "test-1.json": {
      "path": "demo-deduplicate-baseline/test-1.json",
      "sha256": "74b3422476c7b28c86b5f7fc02e69297e20d6822ae00662d1c1e95ca8a1afa59"
    },
    "test-2.json": {
      "path": "demo-deduplicate-baseline/test-2.json",
      "sha256": "fce9e320960aa39fd6280620d48b9712283e642c60f5014cef7094a0bcbbd9c8"
    },
    "test-3.json": {
      "path": "demo-deduplicate-baseline/test-3.json",
      "sha256": "caaeb40a7ca2fe0680aba75749e3f8c11f2fb9c508c2ea9d765be583bd000e4f"
    },
    "workspace.json": {
      "path": "demo-deduplicate-baseline/workspace.json",
      "sha256": "59563da4c23e608a28340cd455c49fd6d8019946e72345e43430f4fd2189c7b8"
    }
  },
  "fixture_hash": "1970df3dd73e124f08f6762c00a0959eea57489d5ec1f7d5a4755e1c6760e69f",
  "run_id": "demo-deduplicate-baseline",
  "schema_version": "1.1",
  "started_at": "2026-09-08T14:54:29.842794+00:00",
  "task_id": "demo-deduplicate"
}
